ID_INICIATIVA,LEGISLATURA,EXTRACTO,F_CREACION,SITUACION,PROCEDIMIENTO,TIPO_FINALIZACION,TIPO_DESCRIPCION
"10L/PE-4616","10","La elaboración y aprobación de la ley canaria del ejercicio profesional de los servicios deportivos, prevista en la disposición adicional tercera de la ley 1/2019, de 30 de enero, de la actividad física y el deporte de canarias, dirigida a la sra. consejera de educación, universidades, cultura y deportes.","2022-03-03","Cerrada","Ordinario","Contestada","PREGUNTAS CON RESPUESTA POR ESCRITO"
"10L/PE-4617","10","Trabajos que se han realizado al objeto de elaborar y aprobar la ley de mecenazgo deportivo de canarias, dirigida a la sra. consejera de educación, universidades, cultura y deportes.","2022-03-03","En tramitación","Ordinario","","PREGUNTAS CON RESPUESTA POR ESCRITO"
"10L/PE-4423","10","Destino concreto de  3.000.000 de euros de la partida 226g0103 equipamiento infraestructuras sanitarias a. e para la isla de fuerteventura, en el presupuesto de canarias para 2022, dirigida al sr, consejero de sanidad.","2022-01-17","Cerrada","Ordinario","Contestada","PREGUNTAS CON RESPUESTA POR ESCRITO"
"10L/PE-4424","10","Destino concreto de 1.500.000 euros de la partida 226g0108 modernización y reposición tecnológica hospitalaria (react eu) para fuerteventura, en el presupuesto de canarias para 2022, dirigida al sr. consejero de sanidad.","2022-01-17","Cerrada","Ordinario","Contestada","PREGUNTAS CON RESPUESTA POR ESCRITO"
"10L/PE-4425","10","Destino concreto de 400.000 euros de la partida 166g0101 obras, reformas y equipamientos g.s.s. fuerteventura, en el presupuesto de canarias para 2022, dirigida al sr. consejero de sanidad.","2022-01-17","Cerrada","Ordinario","Contestada","PREGUNTAS CON RESPUESTA POR ESCRITO"
"10L/PE-4426","10","Programación o cronología prevista para la puesta en funcionamiento de la nueva unidad de hemodinámica en el hospital general de fuerteventura, dirigida al sr. consejero de sanidad.","2022-01-17","Cerrada","Ordinario","Contestada","PREGUNTAS CON RESPUESTA POR ESCRITO"
"10L/PE-4428","10","Número de psicólogos y psiquiatras que se han contratado para el área de salud de fuerteventura en 2020, 2021, y 2022, dirigida al sr. consejero de sanidad.","2022-01-17","Cerrada","Ordinario","Contestada","PREGUNTAS CON RESPUESTA POR ESCRITO"
"10L/PE-4429","10","Gasto durante la pandemia en hoteles en fuerteventura en el servicio de alojamiento para aislamiento o cuarentena de personas por covid-19, dirigida al sr. consejero de sanidad.","2022-01-17","Cerrada","Ordinario","Contestada","PREGUNTAS CON RESPUESTA POR ESCRITO"
"10L/PE-4430","10","Reparto de la ejecución del proyecto 216g0141, denominado uso y calidad tic en el entorno educativo, por importe de 1.000.000 de euros para la isla de fuerteventura, dirigida a la sra. consejera de educación, universidades, cultura y deportes.","2022-01-17","Cerrada","Ordinario","Contestada","PREGUNTAS CON RESPUESTA POR ESCRITO"
"10L/PE-4432","10","Grado de ejecución, material y presupuestaria, del nuevo enlace de oroteanda, en tenerife, dirigida al sr. consejero de obras públicas, transportes y vivienda.","2022-01-17","En tramitación","Ordinario","","PREGUNTAS CON RESPUESTA POR ESCRITO"
"10L/PE-4433","10","Número de viviendas compradas en 2021 en el marco de ejecución del plan de vivienda 2020-2025, dirigida al sr. consejero de obras públicas, transportes y vivienda.","2022-01-17","Cerrada","Ordinario","Contestada","PREGUNTAS CON RESPUESTA POR ESCRITO"
"10L/PE-4434","10","Municipios en los que se han adquirido viviendas en 2021 en el marco de ejecución del plan de vivienda 2020-2025, dirigida al sr. consejero de obras públicas, transportes y vivienda.","2022-01-17","Cerrada","Ordinario","Contestada","PREGUNTAS CON RESPUESTA POR ESCRITO"
"10L/PE-4436","10","Municipios en los que se ha proyectado la ejecución de viviendas en 2021 en el marco de ejecución del plan de vivienda 2020-2025, dirigida al sr. consejero de obras públicas, transportes y vivienda.","2022-01-17","En tramitación","Ordinario","","PREGUNTAS CON RESPUESTA POR ESCRITO"
"10L/PE-4437","10","Número de viviendas que se han rehabilitado en 2021 en el marco de ejecución del plan de vivienda 2020-2025, dirigida al sr. consejero de obras públicas, transportes y vivienda.","2022-01-17","En tramitación","Ordinario","","PREGUNTAS CON RESPUESTA POR ESCRITO"
"10L/PE-4439","10","Motivo de autorización del incremento de gasto de la convocatoria para el ejercicio 2021 de las compensaciones al transporte interinsular de mercancías, dirigida al sr. consejero de obras públicas, transportes y vivienda.","2022-01-17","Cerrada","Ordinario","Contestada","PREGUNTAS CON RESPUESTA POR ESCRITO"
"10L/PE-4443","10","Coste total del desarrollo e implementación de la plataforma online canarian market, dirigida a la sra. consejera de agricultura, ganadería y pesca.","2022-01-17","Cerrada","Ordinario","Contestada","PREGUNTAS CON RESPUESTA POR ESCRITO"
"10L/PE-4444","10","Empresa que ha desarrollado la plataforma canarian market, dirigida a la sra. consejera de agricultura, ganadería y pesca.","2022-01-17","En tramitación","Ordinario","","PREGUNTAS CON RESPUESTA POR ESCRITO"
"10L/PE-4447","10","Objetivos marcados para la elaboración de la estrategia transición justa, dirigida al sr. consejero de transición ecológica, lucha contra el cambio climático y planificación territorial.","2022-01-17","Cerrada","Ordinario","Contestada","PREGUNTAS CON RESPUESTA POR ESCRITO"
"10L/PE-4619","10","La elaboración y aprobación del plan director de instalaciones deportivas de canarias, previsto en el artículo 43 de la ley 1/2019, de 30 de enero, de la actividad física y el deporte de canarias, dirigida a la sra. consejera de educación, universidades, cultura y deportes.","2022-03-03","En tramitación","Ordinario","","PREGUNTAS CON RESPUESTA POR ESCRITO"
"10L/PE-4620","10","Planes estratégicos de la lucha canaria y de los juegos y deportes autóctonos aprobados, en consonancia con la disposición adicional cuarta de la ley 1/2019, de 30 de enero, de la actividad física y el deporte de canarias, dirigida a la sra. consejera de educación, universidades, cultura y deportes.","2022-03-03","En tramitación","Ordinario","","PREGUNTAS CON RESPUESTA POR ESCRITO"
"10L/PE-4621","10","Aprobación del reglamento previsto en el artículo 24 de la ley 1/2019, de 30 de enero, de la actividad física y el deporte de canarias, dirigida a la sra. consejera de educación, universidades, cultura y deportes.","2022-03-03","En tramitación","Ordinario","","PREGUNTAS CON RESPUESTA POR ESCRITO"
"10L/PE-4622","10","Desarrollo reglamentario previsto en el artículo 100 de la ley 1/2019, de 30 de enero, de la actividad física y el deporte de canarias, dirigida a la sra. consejera de educación, universidades, cultura y deportes.","2022-03-03","En tramitación","Ordinario","","PREGUNTAS CON RESPUESTA POR ESCRITO"
"10L/PE-4618","10","La creación del observatorio canario de la actividad física y el deporte, previsto en el artículo 15 y en la disposición adicional quinta de la ley 1/2019, de 30 de enero, de la actividad física y el deporte de canarias, dirigida a la sra. consejera de educación, universidades, cultura y deportes.","2022-03-03","En tramitación","Ordinario","","PREGUNTAS CON RESPUESTA POR ESCRITO"
"10L/PE-4469","10","Los expedientes de la construcción de vivienda pública en lanzarote, dirigida al sr. consejero de obras públicas, transportes y vivienda.","2022-01-20","Cerrada","Ordinario","Contestada","PREGUNTAS CON RESPUESTA POR ESCRITO"
"10L/PE-4471","10","Pasos que quedan para la plena eficacia de la concertación social emanada de la ley de servicios sociales, dirigida a la sra. consejera de derechos sociales, igualdad, diversidad y juventud.","2022-01-20","Cerrada","Ordinario","Contestada","PREGUNTAS CON RESPUESTA POR ESCRITO"
"10L/PE-4473","10","La construcción de la residencia de mayores de alto requerimiento, en teguise, dirigida a la sra. consejera de derechos sociales, igualdad, diversidad y juventud.","2022-01-20","En tramitación","Ordinario","","PREGUNTAS CON RESPUESTA POR ESCRITO"
"10L/PE-4475","10","Presupuesto dedicado al bono turístico por todos los conceptos, dirigida a la sra. consejera de turismo, industria y comercio.","2022-01-21","Cerrada","Ordinario","Contestada","PREGUNTAS CON RESPUESTA POR ESCRITO"
"10L/PE-4476","10","Cantidad gastada y abonada del bono turístico, dirigida a la sra. consejera de turismo, industria y comercio.","2022-01-21","Cerrada","Ordinario","Contestada","PREGUNTAS CON RESPUESTA POR ESCRITO"
"10L/PE-4477","10","Gasto destinado a la publicidad del bono turístico, dirigida a la sra. consejera de turismo, industria y comercio.","2022-01-21","Cerrada","Ordinario","Contestada","PREGUNTAS CON RESPUESTA POR ESCRITO"
"10L/PE-4479","10","Empresas o proveedores encargados del diseño, ejecución, implementación y gestión del bono turístico, dirigida a la sra. consejera de turismo, industria y comercio.","2022-01-21","Cerrada","Ordinario","Contestada","PREGUNTAS CON RESPUESTA POR ESCRITO"
"10L/PE-4448","10","Medidas que se han llevado a cabo en salud mental desde la erupción del volcán de la palma, dirigida al sr. consejero de sanidad.","2022-01-17","Cerrada","Ordinario","Contestada","PREGUNTAS CON RESPUESTA POR ESCRITO"
"10L/PE-4451","10","Conclusiones que se desprenden del i symposium del camino de santiago entre volcanes, dirigida a la sra. consejera de turismo, industria y comercio.","2022-01-17","En tramitación","Ordinario","","PREGUNTAS CON RESPUESTA POR ESCRITO"
"10L/PE-4452","10","Visitas recibidas en el stand de la feria mic celebrada en barcelona, dirigida a la sra. consejera de turismo, industria y comercio.","2022-01-17","Cerrada","Ordinario","Contestada","PREGUNTAS CON RESPUESTA POR ESCRITO"
"10L/PE-4637","10","Las obras de mantenimiento de escuelas infantiles titularidad de la consejería durante 2020, dirigida a la sra. consejera de derechos sociales, igualdad, diversidad y juventud.","2022-03-16","Cerrada","Ordinario","Contestada","PREGUNTAS CON RESPUESTA POR ESCRITO"
"10L/PE-4640","10","Obras de mantenimiento de recursos residenciales para menores migrantes durante 2020, dirigida a la sra. consejera de derechos sociales, igualdad, diversidad y juventud.","2022-03-16","Cerrada","Ordinario","Contestada","PREGUNTAS CON RESPUESTA POR ESCRITO"
"10L/PE-4647","10","Acciones para la atención e intervención con menores en riesgo de exclusión social durante 2021, dirigida a la sra. consejera de derechos sociales, igualdad, diversidad y juventud.","2022-03-16","Cerrada","Ordinario","Contestada","PREGUNTAS CON RESPUESTA POR ESCRITO"
"10L/PE-4656","10","Número de especialistas endocrinos en fuerteventura, dirigida al sr. consejero de sanidad.","2022-03-18","Cerrada","Ordinario","Contestada","PREGUNTAS CON RESPUESTA POR ESCRITO"
"10L/PE-4657","10","El personal laboral en la casa de los coroneles mientras dure el cierre, dirigida a la sra. consejera de educación, universidades, cultura y deportes.","2022-03-18","Cerrada","Ordinario","Contestada","PREGUNTAS CON RESPUESTA POR ESCRITO"
"10L/PE-4658","10","Motivo del cierre de la casa de los coroneles, dirigida a la sra. consejera de educación, universidades, cultura y deportes.","2022-03-18","Cerrada","Ordinario","Contestada","PREGUNTAS CON RESPUESTA POR ESCRITO"
"10L/PE-4659","10","La última vez que se realizaron obras para la conservación de la casa de los coroneles, dirigida a la sra. consejera de educación, universidades, cultura y deportes.","2022-03-18","Cerrada","Ordinario","Contestada","PREGUNTAS CON RESPUESTA POR ESCRITO"
"10L/PE-4661","10","El impulso de la adaptación de la ley canaria de igualdad a la normativa estatal, dirigida a la sra. consejera de derechos sociales, igualdad, diversidad y juventud.","2022-03-18","En tramitación","Ordinario","","PREGUNTAS CON RESPUESTA POR ESCRITO"
"10L/PE-4663","10","Impulso de una ley canaria de conciliación de la vida familiar, personal y laboral en esta legislatura, dirigida a la sra. consejera de economía, conocimiento y empleo.","2022-03-18","Cerrada","Ordinario","Contestada","PREGUNTAS CON RESPUESTA POR ESCRITO"
"10L/PE-4664","10","Medidas para promover el empleo en las mujeres, dirigida a la sra. consejera de economía, conocimiento y empleo.","2022-03-18","En tramitación","Ordinario","","PREGUNTAS CON RESPUESTA POR ESCRITO"
"10L/PE-4666","10","Medidas para promover la aprobación de los planes de igualdad en las empresas privadas, dirigida a la sra. consejera de economía, conocimiento y empleo.","2022-03-18","Cerrada","Ordinario","Contestada","PREGUNTAS CON RESPUESTA POR ESCRITO"
"10L/PE-4652","10","Número de pacientes y tiempo de espera para realizar pruebas diagnósticas en el hospital dr. josé molina orosa, dirigida al sr. consejero de sanidad.","2022-03-17","En tramitación","Ordinario","","PREGUNTAS CON RESPUESTA POR ESCRITO"
"10L/PE-4667","10","Número de solicitudes de reconocimiento de competencias profesionales recibidas en 2021 y número de acreditaciones realizadas, dirigida a la sra. consejera de economía, conocimiento y empleo.","2022-03-21","En tramitación","Ordinario","","PREGUNTAS CON RESPUESTA POR ESCRITO"
"10L/PE-4668","10","Situación del expediente sancionador abierto a la residencia de mayores la milla, en santa maría de guía, dirigida a la sra. consejera de derechos sociales, igualdad, diversidad y juventud.","2022-03-21","En tramitación","Ordinario","","PREGUNTAS CON RESPUESTA POR ESCRITO"
"10L/PE-4673","10","La financiación que se destina a las hospederías casas del mar en los últimos años, dirigida a la sra. consejera de derechos sociales, igualdad, diversidad y juventud.","2022-03-22","Cerrada","Ordinario","Contestada","PREGUNTAS CON RESPUESTA POR ESCRITO"
"10L/PE-4485","10","La incidencia de la covid-19 en los centros educativos, respecto al alumnado contagiado y/o confinado tras las vacaciones de navidad, dirigida a la sra. consejera de educación, universidades, cultura y deportes.","2022-01-25","Cerrada","Ordinario","Contestada","PREGUNTAS CON RESPUESTA POR ESCRITO"
"10L/PE-4489","10","Número de residentes que se han beneficiado del bono turístico canario, dirigida a la sra. consejera de turismo, industria y comercio.","2022-01-25","Cerrada","Ordinario","Contestada","PREGUNTAS CON RESPUESTA POR ESCRITO"
"10L/PE-4490","10","Acciones en fitur 2022 para fomentar los productos agroalimentarios, dirigida a la sra. consejera de agricultura, ganadería y pesca.","2022-01-25","Cerrada","Ordinario","Contestada","PREGUNTAS CON RESPUESTA POR ESCRITO"
"10L/PE-4674","10","Motivos para dejar de celebrar acuerdos con ttoo para potenciar la conectividad mediante co-marketing, dirigida a la sra. consejera de turismo, industria y comercio.","2022-03-22","Cerrada","Ordinario","Contestada","PREGUNTAS CON RESPUESTA POR ESCRITO"
"10L/PE-4675","10","Creación de unidades de referencia en enfermedades raras en las islas capitalinas, en cumplimiento de lo aprobado en la 10l/pnlp-0108, dirigida al sr. consejero de sanidad.","2022-03-22","Cerrada","Ordinario","Contestada","PREGUNTAS CON RESPUESTA POR ESCRITO"
"10L/PE-4676","10","Realización de protocolo para la alimentación materna en las escuelas infantiles, dirigida al sr. consejero de sanidad.","2022-03-22","Cerrada","Ordinario","Contestada","PREGUNTAS CON RESPUESTA POR ESCRITO"
"10L/PE-4677","10","Presupuesto destinado para el tratamiento de enfermedades raras, dirigida al sr. consejero de sanidad.","2022-03-22","Cerrada","Ordinario","Contestada","PREGUNTAS CON RESPUESTA POR ESCRITO"
"10L/PE-4678","10","Plan desarrollado para abordar el tratamiento de las enfermedades raras, dirigida al sr. consejero de sanidad.","2022-03-22","Cerrada","Ordinario","Contestada","PREGUNTAS CON RESPUESTA POR ESCRITO"
"10L/PE-4679","10","Creación de consultas especializadas en enfermedades raras en las islas no capitalinas, en cumplimiento de lo aprobado en la 10l/pnlp-0108, dirigida al sr. consejero de sanidad.","2022-03-22","Cerrada","Ordinario","Contestada","PREGUNTAS CON RESPUESTA POR ESCRITO"
"10L/PE-4680","10","La red de oficinas verdes, dirigida al sr. consejero de transición ecológica, lucha contra el cambio climático y planificación territorial.","2022-03-22","En tramitación","Ordinario","","PREGUNTAS CON RESPUESTA POR ESCRITO"
"10L/PE-4681","10","La celebración en barcelona de las iii jornadas de mujeres lesbianas, bisexuales & aliadas, dirigida a la sra. consejera de derechos sociales, igualdad, diversidad y juventud.","2022-03-23","Cerrada","Ordinario","Contestada","PREGUNTAS CON RESPUESTA POR ESCRITO"
"10L/PE-4682","10","Estado de tramitación de la licitación del proyecto de ejecución de las viviendas de promoción pública en maneje, arrecife, dirigida al sr. consejero de obras públicas, transportes y vivienda.","2022-03-28","Cerrada","Ordinario","Contestada","PREGUNTAS CON RESPUESTA POR ESCRITO"
"10L/PE-4683","10","Planificación en el hierro para dar solución a los alumnos que finalizan su etapa en las aulas enclave, y necesitan mayor tiempo de aprendizaje y adaptación de tránsito a la vida adulta, dirigida a la sra. consejera de educación, universidades, cultura y deportes.","2022-03-28","Cerrada","Ordinario","Contestada","PREGUNTAS CON RESPUESTA POR ESCRITO"
"10L/PE-4684","10","Previsión de puesta en marcha de iniciativas para mejorar la oferta de formación básica inicial en el hierro, dirigida a la sra. consejera de educación, universidades, cultura y deportes.","2022-03-28","Cerrada","Ordinario","Contestada","PREGUNTAS CON RESPUESTA POR ESCRITO"
"10L/PE-4685","10","Estado en que se encuentran los trámites para la conversión de la guardería municipal de valverde en escuela infantil, dirigida a la sra. consejera de educación, universidades, cultura y deportes.","2022-03-28","En tramitación","Ordinario","","PREGUNTAS CON RESPUESTA POR ESCRITO"
"10L/PE-4686","10","Recursos destinados para ayudar a los municipios de el hierro en materia de educación de 0 a 3 años, dirigida a la sra. consejera de educación, universidades, cultura y deportes.","2022-03-28","En tramitación","Ordinario","","PREGUNTAS CON RESPUESTA POR ESCRITO"
"10L/PE-4687","10","Motivos por los que no se ha ejecutado la red de riego de san andrés e isora, dirigida a la sra. consejera de agricultura, ganadería y pesca.","2022-03-28","Cerrada","Ordinario","Contestada","PREGUNTAS CON RESPUESTA POR ESCRITO"
"10L/PE-4688","10","Previsión de puesta en marcha de ayuda económica transitoria para pensionistas emigrantes canarios-venezolanos retornados, dirigida a la sra. consejera de derechos sociales, igualdad, diversidad y juventud.","2022-03-28","Cerrada","Ordinario","Contestada","PREGUNTAS CON RESPUESTA POR ESCRITO"
"10L/PE-4689","10","Medidas adoptadas ante la actual situación de parálisis de las obras de la residencia de mayores de frontera, dirigida a la sra. consejera de derechos sociales, igualdad, diversidad y juventud.","2022-03-28","En tramitación","Ordinario","","PREGUNTAS CON RESPUESTA POR ESCRITO"
"10L/PE-4690","10","Estado en que se encuentran las obras de la avenida marítima de puerto del rosario, entre la zona de la playa de los pozos y el parador, dirigida a la sra. consejera de turismo, industria y comercio.","2022-03-28","Cerrada","Ordinario","Contestada","PREGUNTAS CON RESPUESTA POR ESCRITO"
"10L/PE-4691","10","Estado en que se encuentran las obras de la calle primero de mayo en puerto del rosario, dirigida a la sra. consejera de turismo, industria y comercio.","2022-03-28","Cerrada","Ordinario","Contestada","PREGUNTAS CON RESPUESTA POR ESCRITO"
"10L/PE-4692","10","Situación en que se encuentran las obras del ies la lajita, en fuerteventura, dirigida a la sra. consejera de educación, universidades, cultura y deportes.","2022-03-28","Cerrada","Ordinario","Contestada","PREGUNTAS CON RESPUESTA POR ESCRITO"
"10L/PE-4693","10","Protocolo que existe para la recogida de los desechos sanitarios en el hospital general de fuerteventura, dirigida al sr. consejero de sanidad.","2022-03-28","En tramitación","Ordinario","","PREGUNTAS CON RESPUESTA POR ESCRITO"
"10L/PE-4694","10","Cumplimiento del protocolo existente para la recogida de los desechos sanitarios en el hospital general de fuerteventura, dirigida al sr. consejero de sanidad.","2022-03-28","En tramitación","Ordinario","","PREGUNTAS CON RESPUESTA POR ESCRITO"
"10L/PE-4695","10","Situación en que se encuentran las obras del cae del sur, en fuerteventura, dirigida al sr. consejero de sanidad.","2022-03-28","Cerrada","Ordinario","Contestada","PREGUNTAS CON RESPUESTA POR ESCRITO"
"10L/PE-4697","10","Estrategia promocional que se está llevando a cabo en 2022 para recuperar el turismo, dirigida a la sra. consejera de turismo, industria y comercio.","2022-03-28","Cerrada","Ordinario","Contestada","PREGUNTAS CON RESPUESTA POR ESCRITO"
"10L/PE-4698","10","Número de reuniones que se mantuvieron con organizadores de pruebas deportivas en la international sport convention de londres, dirigida a la sra. consejera de turismo, industria y comercio.","2022-03-28","Cerrada","Ordinario","Contestada","PREGUNTAS CON RESPUESTA POR ESCRITO"
"10L/PE-4699","10","Acciones que se están llevando a cabo para reactivar el comercio en 2022, dirigida a la sra. consejera de turismo, industria y comercio.","2022-03-28","En tramitación","Ordinario","","PREGUNTAS CON RESPUESTA POR ESCRITO"
"10L/PE-4700","10","Conclusiones de la reunión mantenida con tui el 24 de marzo, dirigida a la sra. consejera de turismo, industria y comercio.","2022-03-28","Cerrada","Ordinario","Contestada","PREGUNTAS CON RESPUESTA POR ESCRITO"
"10L/PE-4701","10","Presupuesto destinado para proyectos de formación en alternancia con el empleo para 2022, dirigida a la sra. consejera de economía, conocimiento y empleo.","2022-03-28","Cerrada","Ordinario","Contestada","PREGUNTAS CON RESPUESTA POR ESCRITO"
"10L/PE-4702","10","Número de personas que se han inscrito a la campaña bono bonito de la palma, dirigida a la sra. consejera de turismo, industria y comercio.","2022-03-28","Cerrada","Ordinario","Contestada","PREGUNTAS CON RESPUESTA POR ESCRITO"
"10L/PE-4703","10","Presupuesto destinado para proyectos de formación en alternancia con el empleo durante 2021, dirigida a la sra. consejera de economía, conocimiento y empleo.","2022-03-28","Cerrada","Ordinario","Contestada","PREGUNTAS CON RESPUESTA POR ESCRITO"
"10L/PE-4704","10","Grado de cumplimiento del plan estratégico de subvenciones 2020-2022 del instituto canario de igualdad, dirigida a la sra. consejera de derechos sociales, igualdad, diversidad y juventud.","2022-03-28","Cerrada","Ordinario","Contestada","PREGUNTAS CON RESPUESTA POR ESCRITO"
"10L/PE-4554","10","Importe de las subvenciones otorgadas durante 2021 destinadas a instalaciones de autoconsumo de energías renovables en el sector residencial, dirigida al sr. consejero de transición ecológica, lucha contra el cambio climático y planificación territorial.","2022-02-16","Cerrada","Ordinario","Contestada","PREGUNTAS CON RESPUESTA POR ESCRITO"
"10L/PE-4555","10","Número de turistas extranjeros que nos visitaron durante 2021, dirigida a la sra. consejera de turismo, industria y comercio.","2022-02-16","Cerrada","Ordinario","Contestada","PREGUNTAS CON RESPUESTA POR ESCRITO"
"10L/PE-4556","10","Número de turistas nacionales que nos visitaron durante 2021, dirigida a la sra. consejera de turismo, industria y comercio.","2022-02-16","Cerrada","Ordinario","Contestada","PREGUNTAS CON RESPUESTA POR ESCRITO"
"10L/PE-4557","10","Gasto turístico en las islas durante 2021, dirigida a la sra. consejera de turismo, industria y comercio.","2022-02-16","Cerrada","Ordinario","Contestada","PREGUNTAS CON RESPUESTA POR ESCRITO"
"10L/PE-4696","10","Estado en que se encuentra la implantación de la llamada quinta libertad de transporte aéreo, dirigida al sr. consejero de obras públicas, transportes y vivienda.","2022-03-28","Cerrada","Ordinario","Contestada","PREGUNTAS CON RESPUESTA POR ESCRITO"
"10L/PE-4558","10","Existencia de tratado o convenio bilateral entre el gobierno de canarias y marruecos para el traslado, devolución o repatriación de menores inmigrantes en canarias, dirigida al sr. consejero de administraciones públicas, justicia y seguridad.","2022-02-18","Cerrada","Ordinario","Contestada","PREGUNTAS CON RESPUESTA POR ESCRITO"
"10L/PE-4813","10","Previsión de regular el camping y caravanas como actividad turística y/o producto turístico, dirigida a la sra. consejera de turismo, industria y comercio.","2022-04-28","Cerrada","Ordinario","Contestada","PREGUNTAS CON RESPUESTA POR ESCRITO"
"10L/PE-4814","10","La respuesta del gobierno de españa sobre las acciones adoptadas en cumplimiento de la 10l/pnlp-0355, dirigida al gobierno.","2022-04-28","Cerrada","Ordinario","Contestada","PREGUNTAS CON RESPUESTA POR ESCRITO"
"10L/PE-4815","10","La respuesta del gobierno de españa sobre las acciones adoptadas en cumplimiento de la 10l/pnlp-0377, dirigida al gobierno.","2022-04-28","En tramitación","Ordinario","","PREGUNTAS CON RESPUESTA POR ESCRITO"
"10L/PE-4816","10","Fecha del traslado al gobierno de españa instando el cumplimiento de la 10l/pnlp-0355, dirigida al gobierno.","2022-04-28","Cerrada","Ordinario","Contestada","PREGUNTAS CON RESPUESTA POR ESCRITO"
"10L/PE-4817","10","Fecha del traslado al gobierno de españa instando el cumplimiento de la 10l/pnlp-0337, dirigida al gobierno.","2022-04-28","Cerrada","Ordinario","Contestada","PREGUNTAS CON RESPUESTA POR ESCRITO"
"10L/PE-4818","10","Estado de cumplimiento de la 10l/pnlp-0323, dirigida al sr. consejero de obras públicas, transportes y vivienda.","2022-04-28","En tramitación","Ordinario","","PREGUNTAS CON RESPUESTA POR ESCRITO"
